A1: A
B2: NUMBER | C2: BAND/ARENGER
A3: 1 | B3: A FOGGY DAY | C3: Dave Wople
A4: =A3+1 -> 2 | B4: AFTER THE RAIN | C4: Count Basie and His Orchestra
A5: =A4+1 -> 3 | B5: Against All Odds | C5: Phil Colins Big Band
A6: =A5+1 -> 4 | B6: Air Mail Spetial | C6: Quincy Jones
A7: =A6+1 -> 5 | B7: A latin Line
A8: =A7+1 -> 6 | B8: A Little Tempo , Please | C8: Count Basie and His Orchestra
A9: =A8+1 -> 7 | B9: All Of Me (歌もの） | C9: Lennie Niehaus
A10: =A9+1 -> 8 | B10: All Of Me | C10: Count Basie and His Orchestra
A11: =A10+1 -> 9 | B11: All Of Me | C11: スコアのみ （エリントン版）
A12: =A11+1 -> 10 | B12: All Of Me | C12: Count Basie and His Orchestra
A13: =A12+1 -> 11 | B13: All The Things You Are | C13: Johnny Warrington
A14: =A13+1 -> 12 | B14: American Patrol | C14: Glenn Miller and His Orchestra
A15: =A14+1 -> 13 | B15: And That's That | C15: Count Basie and His Orchestra
A16: =A15+1 -> 14 | B16: April in Paris | C16: Count Basie and His Orchestra
A17: =A16+1 -> 15 | B17: Aquarius | C17: Galt Mac Dermot
A18: =A17+1 -> 16 | B18: A Song For Strayhorn
A19: =A18+1 -> 17 | B19: A Song For You | C19: Woody Herman
A20: =A19+1 -> 18 | B20: A Song For You | C20: Woody Herman
A21: =A20+1 -> 19 | B21: A Square at the Roundtable
A22: =A21+1 -> 20 | B22: As Time Goes By | C22: M.Setsumaru
A23: =A22+1 -> 21 | B23: A Touch Of Canada
A24: =A23+1 -> 22 | B24: A Tribute To Art Fern
A25: =A24+1 -> 23 | B25: Avenue C | C25: Count Basie and His Orchestra
A26: =A25+1 -> 24 | B26: A Warm Breeze | C26: Sammy Nestico
A27: =A26+1 -> 25 | B27: Air Mail Spetial
A28: =A27+1 -> 26 | B28: Air Mail Spetial
A31: B
A32: 1 | B32: Back To The Apple | C32: Count Basie and His Orchestra
A33: =A32+1 -> 2 | B33: Bag A Bone | C33: Count Basie and His Orchestra
A34: =A33+1 -> 3 | B34: Basie | C34: Count Basie and His Orchestra
A35: =A34+1 -> 4 | B35: Basie | C35: Count Basie and His Orchestra
A36: =A35+1 -> 5 | B36: Basie's Bag | C36: Count Basie and His Orchestra
A37: =A36+1 -> 6 | B37: Basie Straight Ahead | C37: Count Basie and His Orchestra
A38: =A37+1 -> 7 | B38: Be Bop and Roses | C38: Woody Herman
A39: =A38+1 -> 8 | B39: Bigin the Beguin
A40: =A39+1 -> 9 | B40: Big Swing Face | C40: Buddy Rich
A41: =A40+1 -> 10 | B41: Birdland | C41: Mayhard Ferguson Big Band
A42: =A41+1 -> 11 | B42: Birdland | C42: Weather Report
A43: =A42+1 -> 12 | B43: Blue and Sentimental
A44: =A43+1 -> 13 | B44: Blue and Sentimental | C44: O.Yoshida
A45: =A44+1 -> 14 | B45: Blues Backstage | C45: Count Basie and His Orchestra
A46: =A45+1 -> 15 | B46: Blues For A Flautist
A47: =A46+1 -> 16 | B47: Blues For Stephanie | C47: Count Basie and His Orchestra
A48: =A47+1 -> 17 | B48: Blues In Hoss' Flat | C48: Count Basie and His Orchestra
A49: =A48+1 -> 18 | B49: Blues In Hoss' Flat | C49: Count Basie and His Orchestra
A50: =A49+1 -> 19 | B50: Blue Tango
A51: =A50+1 -> 20 | B51: Body Language | C51: 五十嵐 謙二
A52: =A51+1 -> 21 | B52: Bone Structure | C52: Lennie Nienaus
A53: =A52+1 -> 22 | B53: Bone Voyage
A54: =A53+1 -> 23 | B54: Bouncin' With Bud
A55: =A54+1 -> 24 | B55: Brazil
A56: =A55+1 -> 25 | B56: Broadway | C56: Count Basie and His Orchestra
A57: =A56+1 -> 26 | B57: But For Now | C57: T.Miyama and His New Hard
A58: =A57+1 -> 27 | B58: Bye Bye Black Bird
A59: =A58+1 -> 28 | B59: By My Side | C59: Count Basie and His Orchestra
A60: =A59+1 -> 29 | B60: By the Time I Got to Phoenix
A61: =A60+1 -> 30 | B61: Ballad For A Rough Year
A62: =A61+1 -> 31 | B62: Bikini Beach
A63: =A62+1 -> 32 | B63: Bopularity | C63: Matt Catingub
A64: =A63+1 -> 33 | B64: Basie Power | C64: Count Basie and His Orchestra
A66: C
A67: 1 | B67: CALL ME IRRESPONSIBLE | C67: Al Cobine
A68: =1+A67 -> 2 | B68: Camel Rice | C68: K.Yoshida
A69: =1+A68 -> 3 | B69: C,B,Express | C69: Count Basie and His Orchestra
A70: =1+A69 -> 4 | B70: CHEEK TO CHEEK
A71: =1+A70 -> 5 | B71: CHEROKEE | C71: Frank Mantooth
A72: =1+A71 -> 6 | B72: CHERRY JUICE
A73: =1+A72 -> 7 | B73: Chicago | C73: K.Kanamori
A74: =1+A73 -> 8 | B74: Chicago
A75: =1+A74 -> 9 | B75: Chicago | C75: Buddy Rich
A76: =1+A75 -> 10 | B76: Coffee and Custanets | C76: Les Hooper
A77: =1+A76 -> 11 | B77: Cold Tater Stomp | C77: Alan F
A78: =1+A77 -> 12 | B78: Concord Blues For Blue | C78: Louie Bellson
A79: =1+A78 -> 13 | B79: Corner Pocket | C79: Count Basie and His Orchestra
A80: =1+A79 -> 14 | B80: Cherokee
A81: =1+A80 -> 15 | B81: Cute | C81: Count Basie and His Orchestra
A82: =1+A81 -> 16 | B82: Caravan | C82: Kunitoshi Yamashita
A83: =1+A82 -> 17 | B83: Caravan | C83: K.Yamaki
A84: =1+A83 -> 18 | B84: Caravan
A85: =1+A84 -> 19 | B85: Caravan | C85: Tubeあり
A86: =1+A85 -> 20 | B86: Caravan
A87: =1+A86 -> 21 | B87: Close to You
A88: =1+A87 -> 22 | B88: COUNT BUBBA
A89: =1+A88 -> 23 | B89: Cruisin' For A Bkuesin'
A90: =1+A89 -> 24 | B90: CHEROKEE | C90: TheChris Walden Big Band
A91: =1+A90 -> 25 | B91: CHEROKEE | C91: Yosushi Haketa
A92: =1+A91 -> 26 | B92: Cold September Morning | C92: Tom Kubis
A94: D
A95: 1 | B95: DANCE ONLY WITH ME
A96: =1+A95 -> 2 | B96: Dancing Men | C96: Buddy Rich
A97: =1+A96 -> 3 | B97: Darn That Dream
A98: =1+A97 -> 4 | B98: Darn That Dream | C98: The Count Basie Orchestra
A99: =1+A98 -> 5 | B99: Day By Day
A100: =1+A99 -> 6 | B100: Days Of Wine And Roses
A101: =1+A100 -> 7 | B101: Departure
A102: =1+A101 -> 8 | B102: Deracinated Flower | C102: The Toshiko Akiyosi Lew Tabackin Big Band
A103: =1+A102 -> 9 | B103: Did'n You
A104: =1+A103 -> 10 | B104: Dinner With Freiends
A105: =1+A104 -> 11 | B105: Dimensions In Blue
A106: =1+A105 -> 12 | B106: Discommotion
A107: =1+A106 -> 13 | B107: Does Anybody Really Know What Time It Is?
A108: =1+A107 -> 14 | B108: Doin' Baise's Thing | C108: Sammy Nestico
A109: =1+A108 -> 15 | B109: Donna Lee
A110: =1+A109 -> 16 | B110: Don't Be That way
A111: =1+A110 -> 17 | B111: Double Dribble
A112: =1+A111 -> 18 | B112: Down For The Duble | C112: Count Basie and His Orchstra
A113: =1+A112 -> 19 | B113: Down For Duble
A114: =1+A113 -> 20 | B114: Down For The Count | C114: Frank Foster
A115: =1+A114 -> 21 | B115: DUET | C115: Neal Hefti
A117: E
A118: 1 | B118: Early Autumn
A119: =1+A118 -> 2 | B119: Easy Jazz Conception For The Section
A120: =1+A119 -> 3 | B120: Easy Money
A121: =1+A120 -> 4 | B121: Easy Money
A122: =1+A121 -> 5 | B122: 88 basie street | C122: Clayton : Hamilton Orch
A123: =1+A122 -> 6 | B123: Emancipation Blues | C123: Count Basie and His Orchetra
A124: =1+A123 -> 7 | B124: EMILY
A125: =1+A124 -> 8 | B125: Every Tub
A126: =1+A125 -> 9 | B126: Evrey Thing's Coming Up Roses
A127: =1+A126 -> 10 | B127: Explosion | C127: Mati Catingub
A129: F
A130: 1 | B130: Fair and Warmer | C130: E.Willkins
A131: =1+A130 -> 2 | B131: Falling in Love with Love
A132: =1+A131 -> 3 | B132: Fancy Meeting You | C132: Count Basie and His Orchetra
A133: =1+A132 -> 4 | B133: Fancy Meeting You | C133: Count Basie and His Orchetra
A134: =1+A133 -> 5 | B134: Fancy Pants
A135: =1+A134 -> 6 | B135: Fan Tail | C135: Count Basie and His Orchetra
A136: =1+A135 -> 7 | B136: Fan Tail | C136: Count Basie and His Orchetra
A137: =1+A136 -> 8 | B137: Fantasy
A138: =1+A137 -> 9 | B138: Fascinating Rhythm
A139: =1+A138 -> 10 | B139: Feelin' Free | C139: Sammy Nestico
A140: =1+A139 -> 11 | B140: Flight of the Foo Bird | C140: Count Basie and His Orchetra
A141: =1+A140 -> 12 | B141: Flight of the Foo Bird | C141: Count Basie and His Orchetra
A142: =1+A141 -> 13 | B142: Flight to Nassau | C142: Count Basie and His Orchetra
A143: =1+A142 -> 14 | B143: Flight to Nassau | C143: メンバー紹介用
A144: =1+A143 -> 15 | B144: Fly Me To The Moon | C144: Y.Nagasaka
A145: =1+A144 -> 16 | B145: Fly Me To The Moon | C145: Count Basie and His Orchetra
A146: =1+A145 -> 17 | B146: Fly Me To The Moon | C146: Tom Kubis
A147: =1+A146 -> 18 | B147: Fly Me To The Moon | C147: John Labarbera
A148: =1+A147 -> 19 | B148: For Lena and Lennie | C148: Count Basie and His Orchetra
A149: =1+A148 -> 20 | B149: Four Brothers | C149: Woody Herman
A150: =1+A149 -> 21 | B150: Four-Eleven West
A151: =1+A150 -> 22 | B151: Four Five Six
A152: =1+A151 -> 23 | B152: Freckle Face
A153: =1+A152 -> 24 | B153: Fredie Freeloader
A154: =1+A153 -> 25 | B154: Fun Time
A155: =1+A154 -> 26 | B155: FuRiSoDe is crying | C155: K.Yamaki
A156: =1+A155 -> 27 | B156: For My Lady | C156: Count Basie and His Orchetra
A157: =1+A156 -> 28 | B157: Fly Me To The Moon
A158: =1+A157 -> 29 | B158: Firm Roots | C158: Count Basie and His Orchetra
A160: G
A161: 1 | B161: Get It On
A162: =1+A161 -> 2 | B162: Get Out of Town
A163: =1+A162 -> 3 | B163: Give Me the Simple Life
A164: =1+A163 -> 4 | B164: Goin' Out of My Head
A165: =1+A164 -> 5 | B165: Going On
A166: =1+A165 -> 6 | B166: Goodbye Poke Pie Hat | C166: Charles Mingus
A167: =1+A166 -> 7 | B167: Good News
A168: =1+A167 -> 8 | B168: Good Time Blues
A169: =1+A168 -> 9 | B169: Goody Goody
A170: =1+A169 -> 10 | B170: Grace
A171: =1+A170 -> 11 | B171: Green Sleeves
A172: =1+A171 -> 12 | B172: Groove Merchant
A173: =1+A172 -> 13 | B173: Groovin' Hard
A174: =1+A173 -> 14 | B174: Groovin' High
A175: =1+A174 -> 15 | B175: Goodbye Poke Pie Hat
A176: =1+A175 -> 16 | B176: Goodbye Poke Pie Hat
A178: H
A179: 1 | B179: Hallelujah
A180: =1+A179 -> 2 | B180: Hard Days Night
A181: =1+A180 -> 3 | B181: Hard Hearted Hannah
A182: =1+A181 -> 4 | B182: Have A Nice Day
A183: =1+A182 -> 5 | B183: Have You Heard
A184: =1+A183 -> 6 | B184: Hay Burner
A185: =1+A184 -> 7 | B185: Heaven on Their Minds
A186: =1+A185 -> 8 | B186: Hello Dolly Cha Cha Cha
A187: =1+A186 -> 9 | B187: Hello Littke Girl
A188: =1+A187 -> 10 | B188: High Five
A189: =1+A188 -> 11 | B189: High Maintenance
A190: =1+A189 -> 12 | B190: Hi-Nokigy
A191: =1+A190 -> 13 | B191: Hittin' 12
A192: =1+A191 -> 14 | B192: Holy Night
A193: =1+A192 -> 15 | B193: Honey Suckle Rose
A194: =1+A193 -> 16 | B194: Hop, Skip, and a Jump
A195: =1+A194 -> 17 | B195: How High the Moon
A196: =1+A195 -> 18 | B196: Here's That Rainy Day | C196: Chris Walden
A198: I
A199: 1 | B199: I Can't Give You Anything But Love
A200: =1+A199 -> 2 | B200: I Can't Stop Loving You
A201: =1+A200 -> 3 | B201: I Can't Stop Loving You | C201: Count Basie and His Orchestra
A202: =1+A201 -> 4 | B202: I Don't Know
A203: =1+A202 -> 5 | B203: If I Were A Bell
A204: =1+A203 -> 6 | B204: Ike, Mike, and Spike
A205: =1+A204 -> 7 | B205: I Left My Heart In Sanfrancisco
A206: =1+A205 -> 8 | B206: I'm Getting' Sentimental Over You
A207: =1+A206 -> 9 | B207: I'm Shoutin' Again
A208: =1+A207 -> 10 | B208: In A Mellow Tone | C208: Count Basie and His Orchestra
A209: =1+A208 -> 11 | B209: In A Mellow Tone | C209: Buddy Rich Big Band
A210: =1+A209 -> 12 | B210: In A Sentimental Mood
A211: =1+A210 -> 13 | B211: Indian Riffs
A212: =1+A211 -> 14 | B212: Indian Summer
A213: =1+A212 -> 15 | B213: Interlude
A214: =1+A213 -> 16 | B214: In The Mood | C214: Glenn Miller
A215: =1+A214 -> 17 | B215: In The Mood | C215: Glenn Miller
A216: =1+A215 -> 18 | B216: In The Mood | C216: Doe Severinsen and the T.S Band
A217: =1+A216 -> 19 | B217: In Your Blue Eyes
A218: =1+A217 -> 20 | B218: I Remember Clifford
A219: =1+A218 -> 21 | B219: It Don't Mean A Thing
A220: =1+A219 -> 22 | B220: It Don't Mean A Thing If It Ain't Got That Swing
A221: =1+A220 -> 23 | B221: It's All Right With Me
A222: =1+A221 -> 24 | B222: It's Oh, So Nice | C222: Count Basie and His Orchestra
A223: =1+A222 -> 25 | B223: It's Oh, So Nice
A224: =1+A223 -> 26 | B224: I've Got You Under My Skin
A225: =1+A224 -> 27 | B225: I Will Wait For You
A227: J
A228: 1 | B228: Jackson Country Jubilee
A229: =1+A228 -> 2 | B229: JA-DA
A230: =1+A229 -> 3 | B230: Tingle Bells
A231: =1+A230 -> 4 | B231: Jive Samba
A232: =1+A231 -> 5 | B232: John The Ⅲ
A233: =1+A232 -> 6 | B233: Jumpin' at the Woodside | C233: Count Baie and His Orch
A234: =1+A233 -> 7 | B234: Jumpin' at the Woodside | C234: Count Baie and His Orch
A235: =1+A234 -> 8 | B235: JUMPY BLUES
A236: =1+A235 -> 9 | B236: Jus Fer Us
A237: =1+A236 -> 10 | B237: Just Friends
A238: =1+A237 -> 11 | B238: Just In Time
A240: K
A241: 1 | B241: Keep The Customer Satisfied
A242: 2 | B242: Killer Joe
A243: 3 | B243: Killing Me Softly
A245: L
A246: 1 | B246: La Fiesta
A247: =1+A246 -> 2 | B247: Laura
A248: =1+A247 -> 3 | B248: Lazy Bird
A249: =1+A248 -> 4 | B249: Lazy Day
A250: =1+A249 -> 5 | B250: Left Hand Funk
A251: =1+A250 -> 6 | B251: Left Hand Funk
A252: =1+A251 -> 7 | B252: Lester Leaps In
A253: =1+A252 -> 8 | B253: Lester Leaps In(スコアのみ）
A254: =1+A253 -> 9 | B254: Lil Darlin'
A255: =1+A254 -> 10 | B255: Little Brown Jug | C255: Art Dedrick
A256: =1+A255 -> 11 | B256: Little Brown Jug | C256: Jeff Hest
A257: =1+A256 -> 12 | B257: Little Girl Blue
A258: =1+A257 -> 13 | B258: Little Karen
A259: =1+A258 -> 14 | B259: Long Yellow Road
A260: =1+A259 -> 15 | B260: Loose Change
A261: =1+A260 -> 16 | B261: Love For Sale
A262: =1+A261 -> 17 | B262: Lover Come Back To Me
A263: =1+A262 -> 18 | B263: Lullaby of Birdland | C263: Count Baie and His Orch
A264: =1+A263 -> 19 | B264: Lullaby of Birdland | C264: Ian McDougall
A265: =1+A264 -> 20 | B265: Lullaby of Birdland
A266: =1+A265 -> 21 | B266: Lupin the Ⅲ '80
A267: =1+A266 -> 22 | B267: Laster Leapes In
A268: =1+A267 -> 23 | B268: Laster Leapes In(2011 NWJO)
A270: M
A271: 1 | B271: Magic
A272: =1+A271 -> 2 | B272: Magic Flea
A273: =1+A272 -> 3 | B273: Makee Me Rainbow
A274: =1+A273 -> 4 | B274: Manteca
A275: =1+A274 -> 5 | B275: Manteca
A276: =1+A275 -> 6 | B276: Manteca
A277: =1+A276 -> 7 | B277: Mas Que Nada
A278: =1+A277 -> 8 | B278: Marguarite
A279: =1+A278 -> 9 | B279: Meditation
A280: =1+A279 -> 10 | B280: Mercy Mercy Mercy
A281: =1+A280 -> 11 | B281: Mexicali Nose
A282: =1+A281 -> 12 | B282: Michelle
A283: =1+A282 -> 13 | B283: Michele
A284: =1+A283 -> 14 | B284: Miles Tones
A285: =1+A284 -> 15 | B285: MissElla
A286: =1+A285 -> 16 | B286: MissElla
A287: =1+A286 -> 17 | B287: Miss Fine
A288: =1+A287 -> 18 | B288: Moanin'
A289: =1+A288 -> 19 | B289: Moanin'
A290: =1+A289 -> 20 | B290: Moanin'
A291: =1+A290 -> 21 | B291: Moanin'
A292: =1+A291 -> 22 | B292: Moanin'
A293: =1+A292 -> 23 | B293: Moanin' | C293: Minhud Big Band
A294: =1+A293 -> 24 | B294: Modal T
A295: =1+A294 -> 25 | B295: MOONLIGHT SERENADE
A296: =1+A295 -> 26 | B296: Moon River
A297: =1+A296 -> 27 | B297: Moten Swing
A298: =1+A297 -> 28 | B298: Moten Swing | C298: Count Basie and His Orch
A299: =1+A298 -> 29 | B299: My Elegy
A300: =1+A299 -> 30 | B300: My Favorite Thing
A301: =1+A300 -> 31 | B301: My Old Kentucky Home | C301: Miles Osmand Big Band
A302: =1+A301 -> 32 | B302: My Old Kentucky Home
A303: =1+A302 -> 33 | B303: misty
A304: =1+A303 -> 34 | B304: misty
A305: =1+A304 -> 35 | B305: Moment's Notice
A306: =1+A305 -> 36 | B306: Microwave it
A308: N
A309: 1 | B309: Nails
A310: =1+A309 -> 2 | B310: Nano
A311: =1+A310 -> 3 | B311: Never On Sunday
A312: =1+A311 -> 4 | B312: Never Will I Marry
A313: =1+A312 -> 5 | B313: New Blues
A314: =1+A313 -> 6 | B314: Nica's Dream
A315: =1+A314 -> 7 | B315: Nica's Dream | C315: Tokyo Ensemble Lab
A316: =1+A315 -> 8 | B316: Nice'n Easy
A317: =1+A316 -> 9 | B317: Night And Day
A318: =1+A317 -> 10 | B318: Night Fever
A319: =1+A318 -> 11 | B319: Night In Tunisia
A320: =1+A319 -> 12 | B320: Night In Tunisia
A321: =1+A320 -> 13 | B321: Night Flight
A322: =1+A321 -> 14 | B322: 9:30 SPECIAL
A323: =1+A322 -> 15 | B323: Nostalgia In Times Square
A324: =1+A323 -> 16 | B324: Nutville
A325: =1+A324 -> 17 | B325: Norweigian Wood | C325: Buddy Rich Orch
A326: =1+A325 -> 18 | B326: Norweigian Wood | C326: Buddy Rich Orch
A328: O
A329: 1 | B329: Oh,That Face
A330: =1+A329 -> 2 | B330: On Green Dolphin Street
A331: =1+A330 -> 3 | B331: On The Sunny Side of the Street
A332: =1+A331 -> 4 | B332: One O'clock Jump
A333: =1+A332 -> 5 | B333: One O'clock Jump | C333: Count Basie and His Orch
A334: =1+A333 -> 6 | B334: Orange Sherbert
A335: =1+A334 -> 7 | B335: Orange Sherbert | C335: Count Basie and His Orch
A336: =1+A335 -> 8 | B336: Orange Sherbert | C336: Count Basie and His Orch
A337: =1+A336 -> 9 | B337: Over the Rainbow
A338: =1+A337 -> 10 | B338: On The Sunny Side of the Street | C338: Ted Heath
A339: =1+A338 -> 11 | B339: One O'clock Jump | C339: Paul Cook
A341: P
A342: 1 | B342: Peace Pipe
A343: =1+A342 -> 2 | B343: Pensive Miss
A344: =1+A343 -> 3 | B344: Perdido/The Preacher
A345: =1+A344 -> 4 | B345: Pithecanthropus Electus
A346: =1+A345 -> 5 | B346: Please Don't Talk About Me When I'm Gone
A347: =1+A346 -> 6 | B347: Pleasingly Plump
A348: =1+A347 -> 7 | B348: Plymouth Rock
A349: =1+A348 -> 8 | B349: Polka Dots and Moon Beams | C349: Masaru Uchibori
A350: =1+A349 -> 9 | B350: Polka Dots and Moon Beams
A351: =1+A350 -> 10 | B351: Put It Right Here
A352: =1+A351 -> 11 | B352: Pressure Cooker
A353: =1+A352 -> 12 | B353: Prime Time
A354: =1+A353 -> 13 | B354: Phill not Bill
A356: Q
A357: 1 | B357: Quietude
A358: 2 | B358: QUINTESSENCE | C358: Quincy Jones and His Orch
A359: 3 | B359: QUINTESSENCE | C359: N.W.J.O 2005
A361: R
A362: 1 | B362: Randi | C362: Phil Woods
A363: 2 | B363: Rat Race | C363: Count Basie and His Orch
A364: 3 | B364: Reuben's Rondo | C364: Oliver Nelson
A365: 4 | B365: Reachin' Out | C365: Count Basie and His Orch
A366: 5 | B366: Road Time Shuffue | C366: Tashiko Akiyash i B.B
A367: 6 | B367: Round Midnight | C367: Cootie Williams Thelonius Monk
A368: 7 | B368: Rush
A370: S
A371: 1 | B371: Samba Song | C371: Chick Corea
A372: 2 | B372: Sassy Lassy | C372: Russ Martino
A373: 3 | B373: Satin Doll | C373: Count Basie and His Orch
A374: 4 | B374: Satin Doll | C374: Takahashi Tatsuya and Tokyo Union
A375: 5 | B375: Sax Case Full O'Blues | C375: John Berry
A376: 6 | B376: Scoot | C376: Count Basie and His Orch
A377: 7 | B377: Scotch and Soda
A378: 8 | B378: Scropple | C378: T.Takahashi
A379: 9 | B379: September | C379: Tropical Jazz Big Band
A380: 10 | B380: Sexy Bus Stop | C380: J.Diamond
A381: 11 | B381: Shiny Stockings | C381: Frank Foster
A382: 12 | B382: Shiny Stockings | C382: Count Basie and His Orch
A383: 13 | B383: Shiny Stockings | C383: Count Basie and His Orch
A384: 14 | B384: Shiny Stockings | C384: Count Basie and His Orch
A385: 15 | B385: Shorty George | C385: K.Yoshida
A386: 16 | B386: Sing A Song Of Love
A387: 17 | B387: Sing Sang Sung
A388: 18 | B388: Sing Sing Sing
A389: 19 | B389: Sing Sing Sing | C389: 山木幸三郎
A390: 20 | B390: Sister Sadie
A391: 21 | B391: Sister Sadie | C391: GRP All Star BigBand
A392: 22 | B392: Sixteen Men Swingin
A393: 23 | B393: Small Talk
A394: 24 | B394: Softly With Feeling
A395: 25 | B395: Solitude
A396: 26 | B396: Somebody Loves Me
A397: 27 | B397: Somebody Waltz
A398: 28 | B398: Sonny Boy
A399: 29 | B399: Soul Intro～The Chicken
A400: 30 | B400: Speak To Liness
A401: 31 | B401: Splanky
A402: 32 | B402: Sprin is Here
A403: 33 | B403: Star Light
A404: 34 | B404: Stolen Moments
A405: 35 | B405: Straight No Chaser
A406: 36 | B406: Stranger
A407: 37 | B407: Strike Up The Band
A408: 38 | B408: Studio J"
A409: 39 | B409: Sugar
A410: 40 | B410: Sugar Loaf Mountain
A411: 41 | B411: Sugar Time
A412: 42 | B412: Summer Place
A413: 43 | B413: Sunset Glow
A414: 44 | B414: Sweet Georgia Brouwn | C414: Count Basie and His Orch
A415: 45 | B415: Sweety Cakes
A416: 46 | B416: Swing Shift
A417: 47 | B417: Swingin' at New port
A418: 48 | B418: Swinging Fingers | C418: Masahiro Kobayashi
A419: 49 | B419: Swingin' the Blues
A420: 50 | B420: Switch In Time | C420: Count Basie and His Orch
A421: 51 | B421: Switch In Time | C421: Count Basie and His Orch
A422: 52 | B422: Switch In Time | C422: Count Basie and His Orch
A423: 53 | B423: SAMBA DEES GODDA DO IT | C423: Tom Kubis
A425: T
A426: 1 | B426: Take Five
A427: 2 | B427: Take Five
A428: 3 | B428: Take the "A" Train | C428: Wilfred Roberts
A429: 4 | B429: Take the "A" Train
A430: 5 | B430: Take the "A" Train | C430: Yasushi Haketa
A431: 6 | B431: Take the "A" Train
A432: 7 | B432: Take the "A" Train
A433: 8 | B433: Take the "A" Train
A434: 9 | B434: Tell Cotton
A435: 10 | B435: Teddy the Toad
A436: 11 | B436: Tell Me A Bedtime Story
A437: 12 | B437: That Warm Feeling
A438: 13 | B438: That' All
A439: 14 | B439: That's the way
A440: 15 | B440: THE BLACK ANGEL
A441: 16 | B441: THE HAWAIIAN WEDDING SONG
A442: 17 | B442: The Heat's On
A443: 18 | B443: The Heat's On
A444: 19 | B444: The Heat's On | C444: Count Basie and His Orch
A445: 20 | B445: The Hustle
A446: 21 | B446: The Midnight Sun Never Set
A447: 22 | B447: The More I See You
A448: 23 | B448: The Queen Bee
A449: 24 | B449: The Snake Was On His Way To A Gig!
A450: 25 | B450: The Spirit Is Willing
A451: 26 | B451: The Spirit Is Willing
A452: 27 | B452: The Sweetest Sounds
A453: 28 | B453: The Teaching Of Blues
A454: 29 | B454: The Way We Are
A455: 30 | B455: Theme from Taxi Driver
A456: 31 | B456: Theme of N.W.J.O '88
A457: 32 | B457: There Will Never Be Another You
A458: 33 | B458: This I Could Be The Start Of Something Big
A459: 34 | B459: This Way
A460: 35 | B460: 3..2.1.0
A461: 36 | B461: Three Views Of A Secret
A462: 37 | B462: Tickle Toe
A463: 38 | B463: Time Check
A464: 39 | B464: Time for a Change
A465: 40 | B465: Times Lie
A466: 41 | B466: Time Stream
A467: 42 | B467: Time Stream | C467: T.Mitsuka
A468: 43 | B468: T.O
A469: 44 | B469: Topsy
A470: 45 | B470: Transience
A471: 46 | B471: Translucence
A472: 47 | B472: Trumpet Blues
A473: 48 | B473: Try To Remember
A474: 49 | B474: Tuning Up
A475: 50 | B475: Two A Way Zone
A476: 51 | B476: Two A Way Zone
A477: 52 | B477: The Flyfisher
A478: 53 | B478: TimeStream | C478: SammyNestico
A479: 54 | B479: Swinging Fingers
A481: U
A482: 1 | B482: Untitled
A483: 2 | B483: Untitled
A484: 3 | B484: Us
A486: V
A487: 1 | B487: Vatican Roulette
A488: 2 | B488: Vine Street Rumble
A490: W
A491: 1 | B491: Walk Don't Run
A492: 2 | B492: Watermelon Man
A493: 3 | B493: Way Out Basie
A494: 4 | B494: What a Little Moonlight Can Do
A495: 5 | B495: What a Wounderful World
A496: 6 | B496: What kind Who Am I?
A497: 7 | B497: When I Fall In Love
A498: 8 | B498: When You're Smiling
A499: 9 | B499: When You wish upon a star
A500: 10 | B500: Where Did You Go
A501: 11 | B501: Whirly Bird
A502: 12 | B502: White X'mas | C502: K.Igarashi
A503: 13 | B503: White X'mas
A504: 14 | B504: Who Can I Turn To?
A505: 15 | B505: Why Not
A506: 16 | B506: Willow Crest
A507: 17 | B507: Willow Crest | C507: Bob Florence
A508: 18 | B508: Willow Crest | C508: Buddy Rich Big Band
A509: 19 | B509: Wind Machine
A510: 20 | B510: Winter Wounderland
A511: 21 | B511: Who Me
A512: 22 | B512: Who Me
A513: 23 | B513: Who Me
A515: Y
A516: 1 | B516: Ya Gotta Try
A517: 2 | B517: Ya Gotta Try
A518: 3 | B518: Ya Gotta Try…Harder
A519: 4 | B519: Yamaha Blues
A520: 5 | B520: Yardbird Suite
A521: 6 | B521: Yes Or No(1)
A522: 7 | B522: Yes Or No(2)
A523: 8 | B523: Yesterdays
A524: 9 | B524: You'd be So Nice to Come Home to
A525: 10 | B525: You'd be So Nice to Come Home to | C525: Oliver Nelson
A526: 11 | B526: You're Not The Kind
A527: 12 | B527: You Stepped Out of A Dream
A528: 13 | B528: You've Made Me So Happy
A529: 14 | B529: Ya Gotta Try
A531: 和
A532: 1 | B532: 愛が止まらない
A533: 2 | B533: 愛の賛歌
A534: 3 | B534: いとしのエリー
A535: 4 | B535: いけにえの踊り
A536: 5 | B536: カッコマン・ブギ
A537: 6 | B537: 悲しき願い
A538: 7 | B538: カム・トゥゲァザー
A539: 8 | B539: 川の流れのように
A540: 9 | B540: きよしこの夜
A541: 10 | B541: サンタが町にやってくる
A542: 11 | B542: ジャンピン・アット・ザ・ウッドサイド
A543: 12 | B543: ステイン・アライブ
A544: 13 | B544: 聖者の行進
A545: 14 | B545: 世界は日の出を待っている
A546: 15 | B546: 抱きしめてTONIGHT
A547: 16 | B547: ダンシング・ヒーロー
A548: 17 | B548: タンホイザー大行進曲
A549: 18 | B549: ディス・ガイ
A550: 19 | B550: 死神
A551: 20 | B551: トイ・ボーイ
A552: 21 | B552: 時の過ぎ行くままに
A553: 22 | B553: みんなのうた
A554: 23 | B554: 森を歩こう
A555: 24 | B555: ヤングマン
A556: 25 | B556: 連絡船恋歌/さだめ川
A557: 26 | B557: 「ロッキー」のテーマ
A558: 27 | B558: 六本木純情派
A559: 28 | B559: おどるポンポコリン
A560: 29 | B560: フックト・オン | C560: エムハチ／TVアニメvol.2
A561: 30 | B561: おどるポンポコリン | C561: ミュージックエイト